SL,User Name,Rating,Review,Medical Name,Resource_Link
485,Sohanul Islam Sohan (সাওবান),4,"Mymensingh Medical College is a government medical college in Bangladesh. It was established in 1924. It is located in the Mymensingh District of Bangladesh. Mymensingh Medical College conducting MBBS, BDS and postgraduate courses in 27 disciplines under Dhaka University and Bangabandhu Sheikh Mujib Medical University (BSMMU). 138 students are admitted in different postgraduate courses in every year, among them 197 students are admitted in MBBS and 52 in BDS courses of which 10% are foreign students.",Mymensingh Medical College Hospital,"https://www.google.com/maps/@22.3591136,91.8415966,15z"
486,Saeed Anwar SHAKIB,5,"everything you search for treatment, got here....",Mymensingh Medical College Hospital,"https://www.google.com/maps/@22.3591136,91.8415966,15z"
487,Areefin Turzo,4,"Mymensingh Medical College (Bengali: ময়মনসিংহ মেডিকেল কলেজ) is a government medical school in Bangladesh, established in 1924. It is located in the Mymensingh District of the Mymensingh Division. Mymensingh Medical Journal, which is Index Medicus/MEDLINE listed, is the official journal of Mymensingh Medical College. Brigadier General Md. Nasir Uddin Ahmed is the present director of the medical college hospital.",Mymensingh Medical College Hospital,"https://www.google.com/maps/@22.3591136,91.8415966,15z"
488,Sleepers Cell,4,good service,Mymensingh Medical College Hospital,"https://www.google.com/maps/@22.3591136,91.8415966,15z"
489,Rony Hasan,5,"Welcome to Mymensingh Medical College: Mymensingh Medical College is a postgraduate government medical college conducting MBBS, BDS and postgraduate courses in 27 disciplines under Dhaka University and Bangabandhu Sheikh Mujib Medical University (BSMMU). Every year 197 students are admitted in MBBS and 52 in BDS courses of which 10% are foreign students and total of 138 students are admitted in different postgraduate courses. It was started in 1924 in Baghmara as “Lytton Medical School”, according to the name of the then Governor of Bengal Mr. Lytton. The medical school had conducted Licentiate of Medical Faculty (LMF) till 1962. Mymensingh Medical College was named in 1962, which started conducting MBBS course with 32 students as the 1st batch (M 01). Mymensingh Medical Journal is the official journal of Mymensingh Medical College which is an Index Medicus / MEDLINE enlisted journal.",Mymensingh Medical College Hospital,"https://www.google.com/maps/@22.3591136,91.8415966,15z"
490,Biswajit K Dey,4,One of the largest public graduate level medical education institution and hospital,Mymensingh Medical College Hospital,"https://www.google.com/maps/@22.3591136,91.8415966,15z"
491,Md:Sohag Hossain,5,This is a very good place for medical treatment and Education......,Mymensingh Medical College Hospital,"https://www.google.com/maps/@22.3591136,91.8415966,15z"
492,Mitul,5,One of the best medical colleges in Bangladesh providing quality medical education.,Mymensingh Medical College Hospital,"https://www.google.com/maps/@22.3591136,91.8415966,15z"
493,Sadman Sakib arno,5,One of the best medical College in Bangladesh.,Mymensingh Medical College Hospital,"https://www.google.com/maps/@22.3591136,91.8415966,15z"
494,Najmul Huda simanto,5,Our medikel,Mymensingh Medical College Hospital,"https://www.google.com/maps/@22.3591136,91.8415966,15z"
495,XABBIN,5,This college is one of the best colleges in the country for providing Medical Education.,Mymensingh Medical College Hospital,"https://www.google.com/maps/@22.3591136,91.8415966,15z"
496,Shohel Rana Khokan,4,Big hospital and to much popular,Mymensingh Medical College Hospital,"https://www.google.com/maps/@22.3591136,91.8415966,15z"
497,Ariful islam,5," four storied College building was built with 18,000 sq.m. of floor area. The Hospital building is adjacent to the college building. The hospital is spread over an area of 58 acres of land (additional 5.7 acres for S. K. hospital). The total capacity of Mymensingh Medical College Hospital is 1000 beds.
Preclinical & Para-clinical disciplines are in College building and clinical disciplines are in Hospital building.
In addition to MBBS and BDS courses, Postgraduate courses are running  in 27 disciplines under Bangabandhu Sheikh Mujib Medical University (BSMMU) and Dhaka University. Among the post graduate courses, MD residency in five disciplines, MS residency in four disciplines, MPhil in five disciplines and  Diploma in ten disciplines. The admissions of undergraduate (MBBS & BDS) courses are conducted by DGHS and postgraduate courses are conducted by BSMMU.",Mymensingh Medical College Hospital,"https://www.google.com/maps/@22.3591136,91.8415966,15z"
498,sagor biswas,5,Good service,Mymensingh Medical College Hospital,"https://www.google.com/maps/@22.3591136,91.8415966,15z"
499,Faiaz Mahabub,5,Nice,Mymensingh Medical College Hospital,"https://www.google.com/maps/@22.3591136,91.8415966,15z"
500,Sakhawat Sohag,4,"An oldest, largest and remarkable hospital in Bangladesh where I practice as a nursing student. Therefore here many special units to treat the patients. Almost there are 60 plus divided ward to treat or provide care of different kinds of patients. 1200 plus nursing staff, 500 plus experienced doctor, 150 plus ward boy work here to make the treatment, care and help the patients and their surrounding as well. I experienced good when in my hands patients get rid from his/ her disease conditions.",Mymensingh Medical College Hospital,"https://www.google.com/maps/@22.3591136,91.8415966,15z"
501,Ashraf Zaman,5,"The biggest hospital in North Bengal region. So many patients come here for treatment of various diseases from Rajshahi and nearby districts. Remarkable number of Patients from Kustia, Meherpur, Chuadanga also come here for treatment. Clean inside and out. Sometimes patients are seen waiting in the queue in front of the doctor's chamber. Outdoor area is always crowded.",Mymensingh Medical College Hospital,"https://www.google.com/maps/@22.3591136,91.8415966,15z"
502,Aslam Hossain,4,"Rajshahi Medical College and Hospital is known in Bangladesh as a modern medical institution.  Thousands of patients come here every day for medical treatment.  Very busy area so some crowds are noticeable.  There is a golden bank in front of the emergency department of this medical college so that all the patients can avail banking services very easily.
♿Wheelchair access is available.  People with disabilities have access.
🚻There is a toilet inside the medical center. However, the toilets are in a very dirty condition.
🅿️There is a garage for parking cars.  On the south side of Sonali Bank.",Rajshahi Medical College Hospital,"https://www.google.com/maps/@22.3591136,91.8415966,15z"
503,Nesar Ahmed,5,"RMCH. After the separation of East Bengal from India in 1947 the people of Rajshahi region were deprived of medical education and healthcare facilities. In 1949 some renowned persons of civil society and political persons involved in administration took initiative to establish a private medical school in Rajshahi city. Initially they launched LMF (Licentiate of Medical Faculty) diploma course under State Medical Faculty Dhaka. Eighty students were admitted in the first batch. In 1954, erstwhile Pakistan government converted it to government medical college. In 1958, it was launched as a complete college. It is the first medical college in northern part of Bangladesh. The first head of department of Anatomy and Physiology were respectively Lieutenant Colonel Gias Uddin Ahmed who was the first principal of this college and Professor Dr. Nayeb Ali. There were 43 students in the first batch including 2 female students and only 5 college staffs. The college and hospital premises are set up on 90 acres of land. The three storied 530 bed hospital was built in 1965 which included medicine, surgery and gynaecology-obstetrics Department. This hospital premises stands on 60 acres of land which was agricultural farm before. 20 bed Infectious disease hospital, leprosy control centre and 150 bed Sadar hospital were affiliated with this hospital and also best resource for oxygen seeker. Thank you.
3
AHZ Creations
AHZ Creat",Rajshahi Medical College Hospital,"https://www.google.com/maps/@22.3591136,91.8415966,15z"
504,AHZ Creations,5,It is a very big hospital but Only in Icu patient get good check up doctor and nurse. Their treatment is good but they do not care about the patient when patient is in ward thats the problem. Although it is good but the behaviour of nurses are not good.,Rajshahi Medical College Hospital,"https://www.google.com/maps/@22.3591136,91.8415966,15z"
505,Sajedur Rahman,3,"Acceptable interns of quality of medical treatment, spacious well, best in western & northern part of Bangladesh, being accepted as second government hospital, more or dependable.",Rajshahi Medical College Hospital,"https://www.google.com/maps/@22.3591136,91.8415966,15z"
506,Minhaz Al Mahmud,5,"The service of Rajshahi medical is one of the worst in Bangladesh. Most of the nurses and staff members behavior towards the patient and their families is really depressing. They really dont care about the patients at all. With poor management and communication system. This place is filled with thiefs and conman. The only good thing about this place is that the treatment is the best with the lowest costs available in Rajshahi . Therefore numerous patients comes here from different places every day.Admitting one of your sick dear family member is one of the challenging task here admists hundreds of people who also wants to be admitted. The process is very slow and it might take the whole day if you don't know anyone who works in the hospital premises or any relative who is a government officer. With no better bathroom facilities for the sick people. Hygiene is one the biggest problem here - the blame goes both to the public and staff members who are in charge of cleaning. I hope the government solve the management system , especially those who are in the front line jobs as they represent Rajshahi Medical hospital and also take measures to control the massive irresponsible public before it gets very worse.",Rajshahi Medical College Hospital,"https://www.google.com/maps/@22.3591136,91.8415966,15z"
507,Mahabub Hasan,5,Good decorated medical college in rajshahi city,Rajshahi Medical College Hospital,"https://www.google.com/maps/@22.3591136,91.8415966,15z"
508,জয়নুল আবেদীন,5,A bunch of specialist offer their best to serve. Regional nuclei of health service.,Rajshahi Medical College Hospital,"https://www.google.com/maps/@22.3591136,91.8415966,15z"
509,Taj Md. Ashfaque Hossain,4,Dirty place. As a Divisional Hospital it is not up to the mark.,Rajshahi Medical College Hospital,"https://www.google.com/maps/@22.3591136,91.8415966,15z"
510,Abdur Rakib,4,"Rajshahi Medical College Hospital is the only tertiary level hospital in this area, situated in the heart of Rajshahi city. The hospital receives a large number of patients from areas including whole Rajshahi division and the northern part of Khulna Division. This institute started its journey in 1958 with only 550 beds but now is able to accommodate around 1700 patients on a daily basis. Everything is fine about rajshahi medical college hospital. But i think if it possible to increase more beds it would be helpful because most of the time patient suffer for bed even i have suffered. @Abdur Rakib",Rajshahi Medical College Hospital,"https://www.google.com/maps/@22.3591136,91.8415966,15z"
511,Satil Siraj,4,It is the largest hospital in Rajshahi division.,Rajshahi Medical College Hospital,"https://www.google.com/maps/@22.3591136,91.8415966,15z"
512,Minhazul Islam roye,5,"6 months ago
This is health service organisation of The Government of peoples Republic of Bangladesh. This is a 1000 bed hospital. Which is important for the Rajshahi city and the surrounding cities...",Rajshahi Medical College Hospital,"https://www.google.com/maps/@22.3591136,91.8415966,15z"
513,Tarek,5,"After the separation of East Bengal from India in 1947 the people of Rajshahi region were deprived of medical education and healthcare facilities. In 1949 some renowned persons of civil society and political persons involved in administration took initiative to establish a private medical school in Rajshahi city. Initially they launched LMF (Licentiate of Medical Faculty) diploma course under State Medical Faculty Dhaka. Eighty students were admitted in the first batch. In 1954, erstwhile Pakistan government converted it to government medical college. In 1958, it was launched as a complete college. It is the first medical college in northern part of Bangladesh. The first head of department of Anatomy and Physiology were respectively Lieutenant Colonel Gias Uddin Ahmed who was the first principal of this college and Professor Dr. Nayeb Ali. There were 43 students in the first batch including 2 female students and only 5 college staffs. The college and hospital premises are set up on 90 acres of land. The three storied 530 bed hospital was built in 1965 which included medicine, surgery and gynaecology-obstetrics Department. This hospital premises stands on 60 acres of land which was agricultural farm before. 20 bed Infectious disease hospital, leprosy control centre and 150 bed Sadar hospital were affiliated with this hospital and also best resource for oxygen seeker.",Rajshahi Medical College Hospital,"https://www.google.com/maps/@22.3591136,91.8415966,15z"
514,Bikolpo Mahamud,5,It's a big medical college and hospital in Bangladesh.,Rajshahi Medical College Hospital,"https://www.google.com/maps/@22.3591136,91.8415966,15z"
515,Jobayer Hossain,5,One of the most famous hospital in north Bengal. You can find here millions of birds. This the main beauty of this hospital. Treatment is also good but not much satisfactory.,Rajshahi Medical College Hospital,"https://www.google.com/maps/@22.3591136,91.8415966,15z"
516,Md Rupak din,3,The health sector of Bangladesh is totally broken. The health minister must resign himself.,Rajshahi Medical College Hospital,"https://www.google.com/maps/@22.3591136,91.8415966,15z"
517,ROKON রোকন 로콘,4,"One of the oldest medical college hospital in North Bengal, Rajshahi.
All type of facilities available here.",Rajshahi Medical College Hospital,"https://www.google.com/maps/@22.3591136,91.8415966,15z"
518,Nafiur Rahman,5,"Rajshahi Medical College (RMC) is a public medical school located in Rajshahi, Bangladesh. The college is affiliated with Rajshahi Medical University. It was the second such institution in erstwhile East Pakistan after Dhaka Medical College. It has a large hospital which is the central provider for advanced health care in the northern part of Bangladesh",Rajshahi Medical College Hospital,"https://www.google.com/maps/@22.3591136,91.8415966,15z"
519,Golam Maula Nawaz,5,Rajshahi Medical College & Hospital is one of the best hospital in the north Bengal side of Bangladesh. Many people comes here to get best treatment and they also happy to get it. They get best treatment at a low cost. The emergency unit is always open that is 24/7. The doctors are very cooperative with their patients and the nurse also the word boys.,Rajshahi Medical College Hospital,"https://www.google.com/maps/@22.3591136,91.8415966,15z"
520,md babu,5,nice mdcl,Rajshahi Medical College Hospital,"https://www.google.com/maps/@22.3591136,91.8415966,15z"
521,ultra gaiming,3,The place is always full of people with there problems of health. The indoor of this medical is very big .and it is the biggest medical in the south Asia .but there are some system fault of there managing . Overall medium .,Rajshahi Medical College Hospital,"https://www.google.com/maps/@22.3591136,91.8415966,15z"
522,Musleh Uddin Chy,5,Largest point of Public Health Services for Rajshahi Division.,Rajshahi Medical College Hospital,"https://www.google.com/maps/@22.3591136,91.8415966,15z"
523,Md. Ashraful islam,5,Best hospital,Rajshahi Medical College Hospital,"https://www.google.com/maps/@22.3591136,91.8415966,15z"
524,Brothers Entertainment,4,Good experience,Rajshahi Medical College Hospital,"https://www.google.com/maps/@22.3591136,91.8415966,15z"
525,Azizul Islam,4,"Rajshahi Medical College is one of the largest medical college in Bangladesh. Their service is amazing, the environment of the medical is good and crowded.",Rajshahi Medical College Hospital,"https://www.google.com/maps/@22.3591136,91.8415966,15z"
526,Munsur Ahammed,5,That was the 1st time i spended 2 nights and 3 days almost sleepless. i had nothing but my jacket to sleep in mid January with freezing weather!,Rajshahi Medical College Hospital,"https://www.google.com/maps/@22.3591136,91.8415966,15z"
527,Abdul Malek,5,I think rajshahi medical college is the medical in north-west side of Bangladesh.,Rajshahi Medical College Hospital,"https://www.google.com/maps/@22.3591136,91.8415966,15z"
528,mimuna ruha,5,🙂,Rajshahi Medical College Hospital,"https://www.google.com/maps/@22.3591136,91.8415966,15z"
529,Md Abu Saheb,4,This medical environment is clear and Fresh!,Rajshahi Medical College Hospital,"https://www.google.com/maps/@22.3591136,91.8415966,15z"
530,Prince RuBeL,5,Excellent service,Rajshahi Medical College Hospital,"https://www.google.com/maps/@22.3591136,91.8415966,15z"
531,Md. Abu Masud Khan,4,"This is one of the popular and crowded medical college hospital in the north-western part of Bangladesh. In fact, Rajshahi Medical college has been transformed as Medical University. And this hospital is operated by Rajshahi Medical University. This is a public hospital and medical services are offered almost free. Since the service value is cheap, crowd of patients remain all seasons. The environment is good but the floors and toilets of every ward are very filthy. Recently, many seasonal birds breed here in the old trees of hospital premises.",Rajshahi Medical College Hospital,"https://www.google.com/maps/@22.3591136,91.8415966,15z"
532,Mehedi hasan Robin,5,Good service,Rajshahi Medical College Hospital,"https://www.google.com/maps/@22.3591136,91.8415966,15z"
533,md nur e alam apurbo,4,Better place for emergency treatment.,Rajshahi Medical College Hospital,"https://www.google.com/maps/@22.3591136,91.8415966,15z"
534,Nayeem Hossain Khan,5,"Rajshahi Medical College Bangladesh – A handful enthusiastic people started a Medical School in Rajshahi city in 1954. A four year course was started leading to diploma LMF (Licentiate of Medical Faculty) offered by the state Medical Faculty, Dhaka. A total of eighty students were admitted in the very first year of its inception. In 1954, the then East Pakistan Government converted it into a government institute, Rajshahi Medical School. Later on, the government decided to start a five year course leading to MBBS (Bachelor of Medicine and Bachelor of Surgery) degree and as such 1958 Rajshahi Medical College came into being. The Medical College was then housed in a small building of the Barendra Museum. It was later shifted to the present college building. Forty two lady and two foreign students were admitted in the first batch.",Rajshahi Medical College Hospital,"https://www.google.com/maps/@22.3591136,91.8415966,15z"
535,Funny Box,5,Very Nice,Rajshahi Medical College Hospital,"https://www.google.com/maps/@22.3591136,91.8415966,15z"
536,MOHAMAD ALI,5,This medicel in a Very important medical in Rajshahi Division.. This medicel Treatment is very good.,Rajshahi Medical College Hospital,"https://www.google.com/maps/@22.3591136,91.8415966,15z"
537,MILTON KUMAR DEBNATH,5,Nice Hospital indeed. This hospital is a part of my life. I am lucky to be here for more than 6+ years. Rajshahi can be a city for medical tourism in future due to have better quality of medical services. I suggest that the service is very much affordable and good.,Rajshahi Medical College Hospital,"https://www.google.com/maps/@22.3591136,91.8415966,15z"
538,Ashraf Siddik,3,Rajshahi medical college and hospital,Rajshahi Medical College Hospital,"https://www.google.com/maps/@22.3591136,91.8415966,15z"
539,Munjur Rabby,5,one of the best medical in Bangladesh,Rajshahi Medical College Hospital,"https://www.google.com/maps/@22.3591136,91.8415966,15z"
540,m hussain,5,"A great place,,,",Rajshahi Medical College Hospital,"https://www.google.com/maps/@22.3591136,91.8415966,15z"
541,Dipanjan Bandhya,5,Very good hospital,Rajshahi Medical College Hospital,"https://www.google.com/maps/@22.3591136,91.8415966,15z"
542,Syed Raiyan,4,Nice architectural design.,Rajshahi Medical College Hospital,"https://www.google.com/maps/@22.3591136,91.8415966,15z"
543,Ismail Hossain,5,"Rajshahi Medical College (RMC) is a government medical school in Bangladesh, established in 1958. It is located in Rajshahi. It is affiliated with Rajshahi University. It was the second such institution in erstwhile East Pakistan after Dhaka Medical College. It has a large hospital that is the central provider for advanced health care in the northern part of Bangladesh.Academic staff
About 220 teachers,administrative staff about 40,Students1600 Undergraduates,1400Postgraduates200. This is a government medical school situated in occupied 60 acres.",Rajshahi Medical College Hospital,"https://www.google.com/maps/@22.3591136,91.8415966,15z"
544,Sowrov Sarwar,3,Need more development and facilities.. 😑😑,Rajshahi Medical College Hospital,"https://www.google.com/maps/@22.3591136,91.8415966,15z"
545,Supria Chaki,5,Good .,Rajshahi Medical College Hospital,"https://www.google.com/maps/@22.3591136,91.8415966,15z"
546,Shorif Hossain,5,It's most big medical college and hospital in Bangladesh.,Rajshahi Medical College Hospital,"https://www.google.com/maps/@22.3591136,91.8415966,15z"
547,Fishal Islam,4,Good service provided,Rajshahi Medical College Hospital,"https://www.google.com/maps/@22.3591136,91.8415966,15z"
548,Abstract Abir,4,All doctors are not polite with patients. But some are really nice. Though a good place to be treated.,Rajshahi Medical College Hospital,"https://www.google.com/maps/@22.3591136,91.8415966,15z"
549,Mursalin Chowdhury,5,One of the biggest medical colleges in Northern Bangla.,Rajshahi Medical College Hospital,"https://www.google.com/maps/@22.3591136,91.8415966,15z"
550,minhaz kabir,5,One of the biggest medical colleges in Northern Bangla.,Rajshahi Medical College Hospital,"https://www.google.com/maps/@22.3591136,91.8415966,15z"
551,minhaz kabir,5,good,Rajshahi Medical College Hospital,"https://www.google.com/maps/@22.3591136,91.8415966,15z"
552,Rownak Shahriar Ruhan,5,"Rajshahi Medical College (RMC) is a government medical school in Bangladesh, established in 1958. It is located in Rajshahi. It is affiliated with Rajshahi University. It was the second such institution in erstwhile East Pakistan after Dhaka Medical College. It has a large hospital that is the central provider for advanced health care in the northern part of Bangladesh.",Rajshahi Medical College Hospital,"https://www.google.com/maps/@22.3591136,91.8415966,15z"
553,Md. Ashrafur Rahaman,4,4★  service....large area with much building,Rajshahi Medical College Hospital,"https://www.google.com/maps/@22.3591136,91.8415966,15z"
554,Fahad Ahmed,5,"Just realize it's a miracle organization for me. I am visiting 2nd time with a quite dead patient and the patient turn to cured day by day.
And also the Doctor and Nurse are so careful to the patient and it's family.
I just like to recommend the organization for any kind of treatment.
Thanks to the RMCH governing body and also the Doctor and Nurse.
At the rest, Thanks to our creator",Rajshahi Medical College Hospital,"https://www.google.com/maps/@22.3591136,91.8415966,15z"
555,MD Atikur Rahman,4,Good medical hospital,Rajshahi Medical College Hospital,"https://www.google.com/maps/@22.3591136,91.8415966,15z"
556,Safayet Rahman Rifat,5,"It is one and only Government Medical College in Rajshahi district.
View of this very good.
Every should be careful all time here",Rajshahi Medical College Hospital,"https://www.google.com/maps/@22.3591136,91.8415966,15z"
557,md hasibul Haque,5,Rajshahi medical College  established in 1958 since that it serve the people. Many famous doctors are completed there MBBS from this College.,Rajshahi Medical College Hospital,"https://www.google.com/maps/@22.3591136,91.8415966,15z"
558,Md Abu Raihan,5,Good medical,Rajshahi Medical College Hospital,"https://www.google.com/maps/@22.3591136,91.8415966,15z"
559,Salaudden Ahmed,5,It is a very good government hospital,Rajshahi Medical College Hospital,"https://www.google.com/maps/@22.3591136,91.8415966,15z"
560,Sofayet Hossain Parvez,5,It’s a beautiful hospital in Bangladesh,Rajshahi Medical College Hospital,"https://www.google.com/maps/@22.3591136,91.8415966,15z"
561,Fayez Anwar,1,I can't believe this hospital is allowed to continue to operate! Utterly disgusting environment and behavior. This hospital should be reported to national and international watchdog agencies.,Rajshahi Medical College Hospital,"https://www.google.com/maps/@22.3591136,91.8415966,15z"
562,Hasibul Islam,5,In one sentence it is a well known medical college  and hospital.,Rajshahi Medical College Hospital,"https://www.google.com/maps/@22.3591136,91.8415966,15z"
563,LED TV Md.Sirajul,5,Good,Rajshahi Medical College Hospital,"https://www.google.com/maps/@22.3591136,91.8415966,15z"
564,Sheikh Muhammad Faisal Siddique,5,"If you're looking for best emergency services and treatments,Rajshahi Medical is must. They're equipped with Medicinal Vehicles like ambulances,Stretchers etcetera. Also been supervised by veteran doctors. Best Medical service in Rajshahi.",Rajshahi Medical College Hospital,"https://www.google.com/maps/@22.3591136,91.8415966,15z"
