SL,User Name,Rating,Review,Medical Name,Resource_Link
211,Yasir Arafat,5,"One of the best medical college s of cumilla district.there have a   Corona dipartment which has 250 bad.dermatology, cardiology, necrology, pediatric,gestroanterlogy,neorology,eye,nose,ear, throat,aorthopedic, colorectal department also have neuclear center,altrasonography,MRI,Eco cardiogram and have very large daiogonistic.The doctor is very experienced and the nurse and wordboy is also experienced.",Comilla Medical College Hospital,"https://www.google.com/maps/@22.3591136,91.8415966,15z"
212,Neaz Morshed,3,One of the vest madical colge  hospital,Comilla Medical College Hospital,"https://www.google.com/maps/@22.3591136,91.8415966,15z"
213,Mohin Uddin,5,One of the big medical college in Bangladesh.  Patients are get a big treatments from this Hospital. Overrall  poor people get free service from here.,Comilla Medical College Hospital,"https://www.google.com/maps/@22.3591136,91.8415966,15z"
214,Mohammad Kamrul Ahasan,5,Better treatment with low cost.,Comilla Medical College Hospital,"https://www.google.com/maps/@22.3591136,91.8415966,15z"
215,Ahmed Galeb,5,"Good environment, service is moderate, will improve over time.",Comilla Medical College Hospital,"https://www.google.com/maps/@22.3591136,91.8415966,15z"
216,SHUPRIO PAUL,4,"As a tertiary level govt. hospital, it is good, cleaned and well environment. But sometimes patients pressure are so much exetream that everything is mismanaged.  Doctors are very cordial and professionally specialist here. Old is building is little bit noisy in the busy hours and set ups are older.",Comilla Medical College Hospital,"https://www.google.com/maps/@22.3591136,91.8415966,15z"
217,Mahmud Ullah,5,"it’s a prominent hospital in Cumilla, people come here to take the proper treatment but they always cannot serve the proper treatment for patient's demand. Environment of this hospital is so poor.the doctors are so helpful and friendly to the patients.",Comilla Medical College Hospital,"https://www.google.com/maps/@22.3591136,91.8415966,15z"
218,MR.JILANI,5,Amazing,Comilla Medical College Hospital,"https://www.google.com/maps/@22.3591136,91.8415966,15z"
219,Arif Khan,1,"t’s is very bad hospital for denger paison!!
Some doctors and Nurse 🖕🖕",Comilla Medical College Hospital,"https://www.google.com/maps/@22.3591136,91.8415966,15z"
220,Sheikh Sultanul Hasan,5,Gathering of excellent  physician and trainees. Complete work up to diagnosis of a  disease though there is huge patient than that of its capacity,Comilla Medical College Hospital,"https://www.google.com/maps/@22.3591136,91.8415966,15z"
221,Md. Sirajul Islam,5,The biggest Government Hospital and Medical College in Cumilla.,Comilla Medical College Hospital,"https://www.google.com/maps/@22.3591136,91.8415966,15z"
222,sumit saha,4,As a government hospital one should not expect so high. But with all it's limitations service is good.,Comilla Medical College Hospital,"https://www.google.com/maps/@22.3591136,91.8415966,15z"
223,Mobinul Islam,5,"a medical college. this medical college is one of the best medical college of Bangladesh. many students read here.
this place is very nice and quite also.
this place is crowded. and there has a lot of car parking space.this medical college is very renowned. over all this place is so beautiful.
and it's a good medical college.",Comilla Medical College Hospital,"https://www.google.com/maps/@22.3591136,91.8415966,15z"
224,mashiur rahman,1,Good,Comilla Medical College Hospital,"https://www.google.com/maps/@22.3591136,91.8415966,15z"
225,Ak Suman,5,Required more improvement,Comilla Medical College Hospital,"https://www.google.com/maps/@22.3591136,91.8415966,15z"
226,Sayef Raihan,3,"The foundation stone of Comilla Medical College was laid by president Zia on 28th November 1979. Only 30 students were admitted in the session 1981-82 but its academic activity stopped in 1982 & students were transferred to different government Medical College. Due to the continuous demand of local people, Bangladesh Medical Association & political leaders, Comilla Medical College Restart it’s function in 1992 based on the infrastructure of Medical Assistant Training School (MATS) & 250 bed Modernized Hospital, Comilla . All facilities of MATS including manpower merged with Medical College. 50 students were admitted in the session 1991-92. The number of students was doubled to 100 from the session 2005-2006 & admitted of students 117 from the session 2011-2012. Now MATS has been shifted to another campus. The new academic building of the college functionally started in the year 2008.",Comilla Medical College Hospital,"https://www.google.com/maps/@22.3591136,91.8415966,15z"
227,Shahadat Hossain,5,Service is good,Comilla Medical College Hospital,"https://www.google.com/maps/@22.3591136,91.8415966,15z"
228,Abdul Mannan,5,Discipline is fine,Comilla Medical College Hospital,"https://www.google.com/maps/@22.3591136,91.8415966,15z"
229,Md. Saffat Hossain Bhuiyan,4,Largest Govt. Hospital with 500 beds with Medical College in Cumilla & near district.,Comilla Medical College Hospital,"https://www.google.com/maps/@22.3591136,91.8415966,15z"
230,Mostafa Kamal,3,"Need more development regarding neat and Cleanliness. Too much patients but number of doctors are less.
Over all ok but we hope it will change with in short time.",Comilla Medical College Hospital,"https://www.google.com/maps/@22.3591136,91.8415966,15z"
231,Kamrul Hassan Khan,4,Good,Comilla Medical College Hospital,"https://www.google.com/maps/@22.3591136,91.8415966,15z"
232,Jiban Krisna,4,Good,Comilla Medical College Hospital,"https://www.google.com/maps/@22.3591136,91.8415966,15z"
233,AM,5,"Comilla Medical College Construction began in 1979, with the college open for one year from 1981-1982 before it closed for a decade. Reopened in 1992 due to local demand, the college offers MBBS degrees.
Two female hostels, two male hostels, and two internee hostels are in the campus & also Resident hostel for post graduate students.
8",Comilla Medical College Hospital,"https://www.google.com/maps/@22.3591136,91.8415966,15z"
234,Assalam Agro Tech Limited Managing Director,5,"Comilla Medical College Hospital is one of the prominent medical sciences studies institution at Comilla Sadar Upazila in greater Comilla Region!
The structural and scenic beauty is existing !
The educational systems is comparatively develop!
We didn't no that, the indoor or outdor treatment facilities is not worst!
One day will come the an excellent  treatment facilities will be providing  in here for rural poor peoples! We always expect that!
Students politics is a hampering factor for every institutions in Bangladesh like it!
Good wishes for success of all students, teachers and all linked people for both eternal & earthnal life!
",Comilla Medical College Hospital,"https://www.google.com/maps/@22.3591136,91.8415966,15z"
235,Dr. M Morshed,5,"Comilla Medical College is a government medical college, near Kuchaituli in Cumilla, Bangkadesh. Construction began in 1979, with the college open for one year from 1981-1982 before it closed for a decade. Reopened in 1992 due to local demand, the college offers MBBS degrees along some post-graduation degrees.",Comilla Medical College Hospital,"https://www.google.com/maps/@22.3591136,91.8415966,15z"
236,Aminul Islam Rifat,5,"It is one of charming medical college in Bangaldesh..
Boy's Hostel is really enormous with well furnished. But it is a matter of sorrow that even there are no Structured Mosque.",Comilla Medical College Hospital,"https://www.google.com/maps/@22.3591136,91.8415966,15z"
237,"Abul Hasan SFMM KPJ Dhaka, 98",3,"One of the Best medical college in Bangladesh from Govt for MBBS degree.
Very well education and doctor quality. After degree they do work in BD and others country too after more education.
Services is cheap. Need more cleanliness and quality to improve and 24 Hours Specialized doctor facilities as it's cover more no of population.",Comilla Medical College Hospital,"https://www.google.com/maps/@22.3591136,91.8415966,15z"
238,Sharif Parvez,4,"Very Good environment. The land of this hospital has been taken from us during Zia’s tenure, the construction work was delayed significantly. The Medical College and the hospital is located on our agricultural fields in Baropara village, even though the entrance of the hospital is from Kuchitoli side. I have visited this hospital in August 2017, together with my cousin brother, who is a councillor of this area.",Comilla Medical College Hospital,"https://www.google.com/maps/@22.3591136,91.8415966,15z"
239,Abdullah Al Masud,4,services provided by comilla medical  are much better than many private medical.. and cheaper too..all tests are done at a fraction of cost.. but digital x ray is not available here..City scan is available. What i'v experienced that you'll get excellent medical care if some doctors are known to you..The doctors are also very much passionate about their duties,Comilla Medical College Hospital,"https://www.google.com/maps/@22.3591136,91.8415966,15z"
240,Zest Mahmud,5,"Comilla Medical College is a government medical school near Kuchaitoli in Cumilla, Bangladesh. Construction began in 1979, with the college open for one year from 1981-1982 before it closed for a decade. Reopened in 1992 due to local demand, the college offers MBBS degrees.",Comilla Medical College Hospital,"https://www.google.com/maps/@22.3591136,91.8415966,15z"
241,Sohanul Islam Sohan (সাওবান),4,"Comilla Medical College is a government medical college in Comilla, Bangladesh. The construction of Comilla Medical College began in 1979, with the college open for one year from 1981-1982 before it closed for a decade. Reopened in 1992. Comilla Medical College offers MBBS degrees. Comilla Medical College is a public institution affiliated by Chittagong University.",Comilla Medical College Hospital,"https://www.google.com/maps/@22.3591136,91.8415966,15z"
242,Arif Billah,5,"Comilla Medical College is one of the best medical colleges in Bangladesh. Many foreign students from Pakistan, Nepal, Maldives, India are studying in this medical college.",Comilla Medical College Hospital,"https://www.google.com/maps/@22.3591136,91.8415966,15z"
243,Dr M K Maheer,5,"This is one of the leading medical colleges of the country, ranking 8th among all the government and non-government medical colleges. About 500 students are accommodated and taught the art of medicine and surgery at any particular time of the year. It also has a 500 bed hospital beside the academic building which is the best hospital in this region of the country. The medical college is more or less politics free and provides an excellent environment to the students to reach their ultimate goal in being a good medical practitioner. The whole campus, hostel and the hospital area is said to be one of the most beautiful campuses of the country. As a whole, this is a great place to stay and as well as, to study, play and learn.",Comilla Medical College Hospital,"https://www.google.com/maps/@22.3591136,91.8415966,15z"
244,Mamunur Rashid,5,This is a govt medical college and 500 beaded hospital also all kind medical facilities available here…,Comilla Medical College Hospital,"https://www.google.com/maps/@22.3591136,91.8415966,15z"
245,jackie barua,5,A wonderful medical college. . .having all type of studying & extracurricular facilities.,Comilla Medical College Hospital,"https://www.google.com/maps/@22.3591136,91.8415966,15z"
246,Jamal Hossain,5,It is a good place for getting medical treatment.,Comilla Medical College Hospital,"https://www.google.com/maps/@22.3591136,91.8415966,15z"
247,Md. Omar Hossain,1,Nurses stuff behaviour so poor,Comilla Medical College Hospital,"https://www.google.com/maps/@22.3591136,91.8415966,15z"
248,HASSAN JEWEL,5,Good,Comilla Medical College Hospital,"https://www.google.com/maps/@22.3591136,91.8415966,15z"
249,Md. Mafujul Islam,4,"The foundation stone of Cumilla Medical College was laid by president Zia on 28th November 1979. Only 30 students were admitted in the session 1981-82 but its academic activity stopped in 1982 & students were transferred to different government Medical College. Due to the continuous demand of local people, Bangladesh Medical Association & political leaders, Comilla Medical College Restart it’s function in 1992 based on the infrastructure of Medical Assistant Training School (MATS) & 250 bed Modernized Hospital, Comilla . All facilities of MATS including manpower merged with Medical College. 50 students were admitted in the session 1991-92. The number of students was doubled to 100 from the session 2005-2006 & admitted of students 117 from the session 2011-2012. Now MATS has been shifted to another campus. The new academic building of the college functionally started in the year 2008.",Comilla Medical College Hospital,"https://www.google.com/maps/@22.3591136,91.8415966,15z"
250,Monir Hosen,5,"This is area so nice, clean and treatment very good",Comilla Medical College Hospital,"https://www.google.com/maps/@22.3591136,91.8415966,15z"
251,Roman Ahmed,5,"I love this place...beautiful campus and an extraordinary academic standard,proud to be a part…",Comilla Medical College Hospital,"https://www.google.com/maps/@22.3591136,91.8415966,15z"
252,prince mahir,5,Comilla medical collage hospital I have a lot of memorable day in this place,Comilla Medical College Hospital,"https://www.google.com/maps/@22.3591136,91.8415966,15z"
253,Entertainment VEVO,5,"Comilla Medical College is a government medical school near Kuchaitoli in Comilla, Bangladesh. Construction began in 1979, with the college open for one year from 1981-1982 before it closed for a decade. Reopened in 1992 due to local demand, the college offers MBBS degrees",Comilla Medical College Hospital,"https://www.google.com/maps/@22.3591136,91.8415966,15z"
254,Asim Das Amit,5,"Comilla Medical College is a government medical school near Kuchaitoli in Comilla, Bangladesh. Construction began in 1979, with the college open for one year from 1981-1982 before it closed for a decade. Reopened in 1992 due to local demand, the college offers MBBS degrees.",Comilla Medical College Hospital,"https://www.google.com/maps/@22.3591136,91.8415966,15z"
255,Front Line View,3,"Comilla Medical College is a government medical school near Kuchaitoli in Comilla, Bangladesh. Construction began in 1979, with the college open for one year from 1981-1982 before it closed for a decade. Reopened in 1992 due to local demand, the college offers MBBS degrees.",Comilla Medical College Hospital,"https://www.google.com/maps/@22.3591136,91.8415966,15z"
256,Raquibul Hasan,3,"Comilla Medical College is a government medical school near Kuchaitoli in Cumilla, Bangladesh. Construction began in 1979, with the college open for one year from 1981-1982 before it closed for a decade. Reopened in 1992 due to local demand, the college offers MBBS degrees",Comilla Medical College Hospital,"https://www.google.com/maps/@22.3591136,91.8415966,15z"
257,Technovert,4,"It is a small infirmary in comilla. Its a public medical college both used for teaching and curing. there are several boys and girls hostel. there are cafeteria where you will get necessary item. there is a restaurant called mitali, where you can find khichuri, nasta and other item. I preferred mitali because i liked it food. there are many other resturants you should also try. there is a ''mama's Jhalmuri' which is famous and there are also a nut-seller which is famous among students. but the roads are not developed .If you ever go to comilla then you should visit comilla medical college.",Comilla Medical College Hospital,"https://www.google.com/maps/@22.3591136,91.8415966,15z"
258,Md Kamal Hossain,5,Very well,Comilla Medical College Hospital,"https://www.google.com/maps/@22.3591136,91.8415966,15z"
259,Fayez Ahmed,5,This is one of the best hospital in Eastern Bangladesh,Comilla Medical College Hospital,"https://www.google.com/maps/@22.3591136,91.8415966,15z"
260,Mahbub Salim,5,This is Medical Cillege,Comilla Medical College Hospital,"https://www.google.com/maps/@22.3591136,91.8415966,15z"
261,Dr. Lala Shourav Das,5,Good public medical college & hospital.,Comilla Medical College Hospital,"https://www.google.com/maps/@22.3591136,91.8415966,15z"
262,Prue Prince,5,"Near to the Capital City Dhaka the Comilla Medical College Campus & Hospital is the Learning curve for MBBS students and Post Graduate & Trainee Doctors as well. A calm, Quiet yet not isolated campus away from the light & Noise of main City is a Nice place to live, to fix future plans & to study & learn the art of Medical Science. A well equipped Hospital with over 500 Beds, Quality Teaching Stuff, Friendly Seniors & Colleagues certainly Helps!!!
Pleased for being a CoMC student and Now an Intern @ CoMC Hospital.",Comilla Medical College Hospital,"https://www.google.com/maps/@22.3591136,91.8415966,15z"
263,Sunny khan,1,"Dear admin, hospital bathroom is very bad smell and dirty, housekeeping should keep it clean and spray. The patients going there for treatment but this situation patient will more affect bacteria. Please ASAP",Comilla Medical College Hospital,"https://www.google.com/maps/@22.3591136,91.8415966,15z"
264,Sameen Mahathir,1,very bad sevice,Comilla Medical College Hospital,"https://www.google.com/maps/@22.3591136,91.8415966,15z"
265,Mohammad Asgar Ali Khan,5,Useful,Comilla Medical College Hospital,"https://www.google.com/maps/@22.3591136,91.8415966,15z"
266,Samairaislam Samairaislam,5,its place is so important for all people of comilla..,Comilla Medical College Hospital,"https://www.google.com/maps/@22.3591136,91.8415966,15z"
267,A. N. M. Jamiul Islam,5,"POLITICS FREE, FRIENDLY ENVIRONMENT, STRICT TEACHING PANEL, THE BEST ONE CAN EXPECT.",Comilla Medical College Hospital,"https://www.google.com/maps/@22.3591136,91.8415966,15z"
268,Md Golam Sarwar,5,Nice,Comilla Medical College Hospital,"https://www.google.com/maps/@22.3591136,91.8415966,15z"
269,Gaming Faruk Boss,5,Gokulam medical college,Comilla Medical College Hospital,"https://www.google.com/maps/@22.3591136,91.8415966,15z"
270,Masum Rahman,5,Great public hospital in Comilla.,Comilla Medical College Hospital,"https://www.google.com/maps/@22.3591136,91.8415966,15z"
271,Tarekul Islam Shova,5,The best government medical college of Comilla.,Comilla Medical College Hospital,"https://www.google.com/maps/@22.3591136,91.8415966,15z"
272,Oneel Rehmaan,5,"Comilla Medical College One of the best Bangladeshi medical college is located in comilla, the nearer town from dhaka. There is a girl in my village,who has started her new life withthis college. I pray she will doing great.

BIPUL,GURUDASHPUR,NATORE",Comilla Medical College Hospital,"https://www.google.com/maps/@22.3591136,91.8415966,15z"
273,Shah Minhaz,5,u given many thingzz to me...we owe to u....proud to b a PART OF IT....,Comilla Medical College Hospital,"https://www.google.com/maps/@22.3591136,91.8415966,15z"
274,Neyamot Ullah,4,great place for doing your heallth treatments,Comilla Medical College Hospital,"https://www.google.com/maps/@22.3591136,91.8415966,15z"
275,Nur Nabi,4,It's excellent medical college & hospital.,Comilla Medical College Hospital,"https://www.google.com/maps/@22.3591136,91.8415966,15z"
276,Khan Creation,5,It's a nice medical college,Comilla Medical College Hospital,"https://www.google.com/maps/@22.3591136,91.8415966,15z"
277,Androboyz,5,"Comilla Medical College is a government medical school near Kuchaitoli in Comilla, Bangladesh. Construction began in 1979, with the college open for one year from 1981-1982 before it closed for a decade.",Comilla Medical College Hospital,"https://www.google.com/maps/@22.3591136,91.8415966,15z"
278,Bayezid Hossain,5,Best medical College in Cumilla.,Comilla Medical College Hospital,"https://www.google.com/maps/@22.3591136,91.8415966,15z"
279,Monir Ahamed,5,an emergency     help  centre  for any injured.,Comilla Medical College Hospital,"https://www.google.com/maps/@22.3591136,91.8415966,15z"
280,Omor Faruq,3,"Some places are  too much dirty, doctor and nurse not take care patient properly.",Comilla Medical College Hospital,"https://www.google.com/maps/@22.3591136,91.8415966,15z"
281,unlimited shadin,1,Need more special treatment..,Comilla Medical College Hospital,"https://www.google.com/maps/@22.3591136,91.8415966,15z"
282,Tariqul Islam,5,One of the best medical colleges .,Comilla Medical College Hospital,"https://www.google.com/maps/@22.3591136,91.8415966,15z"
283,Mh Rana,1,Wrong Place. This area is owns by noakhali.,Comilla Medical College Hospital,"https://www.google.com/maps/@22.3591136,91.8415966,15z"
284,Labib Tanjim,4,Government medical college in cumilla.,Comilla Medical College Hospital,"https://www.google.com/maps/@22.3591136,91.8415966,15z"
285,Dhimanendu Roy Dhiman,5,Very responsive to patient management,Comilla Medical College Hospital,"https://www.google.com/maps/@22.3591136,91.8415966,15z"
286,Afzal Bin Hossain,3,It is a Tertiary lavel Health Care at Comilla.,Comilla Medical College Hospital,"https://www.google.com/maps/@22.3591136,91.8415966,15z"
287,Afzal Bin Hossain,3,such a good place,Comilla Medical College Hospital,"https://www.google.com/maps/@22.3591136,91.8415966,15z"
288,Avijit Roy (Kabyo),5,"No 5 in ranking. Awesome services, but ward services are too bad.",Comilla Medical College Hospital,"https://www.google.com/maps/@22.3591136,91.8415966,15z"
289,Audiology Bangladesh,5,Good public hospital in Comilla.,Comilla Medical College Hospital,"https://www.google.com/maps/@22.3591136,91.8415966,15z"
290,Afzal jambary All song and video,1,Welcome,Comilla Medical College Hospital,"https://www.google.com/maps/@22.3591136,91.8415966,15z"
291,Md. Rayhan Yousuf,3,Crowded place,Comilla Medical College Hospital,"https://www.google.com/maps/@22.3591136,91.8415966,15z"
292,Nijum Making,5,One of the Government Medical College at comilla in Bangladesh,Comilla Medical College Hospital,"https://www.google.com/maps/@22.3591136,91.8415966,15z"
293,Shahadat Hossain,5,best medical collage,Comilla Medical College Hospital,"https://www.google.com/maps/@22.3591136,91.8415966,15z"
294,md yasin ali,5,"Section 10, Dhaka 1216",Comilla Medical College Hospital,"https://www.google.com/maps/@22.3591136,91.8415966,15z"
295,Labib Hoque,5,Government Medical College & Hospital,Comilla Medical College Hospital,"https://www.google.com/maps/@22.3591136,91.8415966,15z"
296,KHALEDUR RAHMAN,5,A healthy place.,Comilla Medical College Hospital,"https://www.google.com/maps/@22.3591136,91.8415966,15z"
297,Ajanta Das,4,nice one,Comilla Medical College Hospital,"https://www.google.com/maps/@22.3591136,91.8415966,15z"
298,Khizir Ahamed,5,Biggest hospital in Comilla.,Comilla Medical College Hospital,"https://www.google.com/maps/@22.3591136,91.8415966,15z"
299,Rashed Khan,5,Nice Place,Comilla Medical College Hospital,"https://www.google.com/maps/@22.3591136,91.8415966,15z"
300,Tirtha Mitra,5,"It's an one of the big hospital,but some doctors are not good enough to treatment people ,they don't know how to talk with general people 😅😅
It's very upsetting that they are highly educated but don't know the minimum behavior with general 🙂
They often hanker after money!!
Shameful It's!!😐😐",Comilla Medical College Hospital,"https://www.google.com/maps/@22.3591136,91.8415966,15z"
301,Imran Hasan,4,One of the oldest medical college of Bangladesh.For a long time it was the only tertiary care providing hospital for Barisal division.Its emergency department is open 24×7. This medical college has huge campus area. All necessary department is available.,Comilla Medical College Hospital,"https://www.google.com/maps/@22.3591136,91.8415966,15z"
302,raiyan zaman,5,"One of the oldest medical in Bangladesh.
Service: good
Environment : well
Doctors : available always
Overall good.",Sher-E-Bangla Medical College Hospital,"https://www.google.com/maps/@22.3591136,91.8415966,15z"
303,SiyaN Biswas Dipon,5,"Sher-e-Bangla Medical College (SBMC) is a government medical school in Bangladesh, established in 1968. The college is located in Barisal. It is affiliated with University of Dhaka as a constituent college. SBMC awards MBBS degree and offers professional training and medical research facility at its hospital with 1000 beds. As per the declaration of overseas registration of the General Medical Council, the awarded MBBS degree during or after October 1984 is eligible to apply for registration in United Kingdom. The college has an area of about 81.545 acres. Student dormitories, nursing institute, nurses' training institute, dormitory for staff nurses, and residences of teachers are situated on the campus. HISTORY: Construction began on the college on 6 November 1964, at which time it was known as Barisal Medical College.[3] It opened to students in 1968 and was soon renamed to its current title, bestowed in honor of former prime minister A. K. Fazlul Huq in 1977.,[3] a resident of Barisal, was often called by the phrase ""Sher-e-Bangla"", which translates ""The Tiger of Bengal"".",Sher-E-Bangla Medical College Hospital,"https://www.google.com/maps/@22.3591136,91.8415966,15z"
304,Abdul Mohaimen Jobayer,4,"One of the oldest and the best medical colleges in Bangladesh.  The whole hospital is in a building.  Anybody new here can lost, because it is too large. The main building is five streyed building. It has almost all types all facilities that a hospital should have. It serve all kinds of pathelogical test and treatment. It is tried to keep up with the modern facilities.",Sher-E-Bangla Medical College Hospital,"https://www.google.com/maps/@22.3591136,91.8415966,15z"
