SL,User Name,Rating,Review,Medical Name,Resource_Link
636,Shahriar Evan,2,Over crowded..no protection in pandemic,Sir Salimullah Medical College,"https://www.google.com/maps/@22.3591136,91.8415966,15z"
637,Mamun Sikdar Masud,3,All service are low cost but to get this free or low cost service we need to bribe their stuff. As it is govt. service fact.,Sir Salimullah Medical College,"https://www.google.com/maps/@22.3591136,91.8415966,15z"
638,tamanna ahmed,5,"as much as I can write about mitford hospital is this the place where i belong.
this is like a home to me, i spend most precious times of my life in mitford and mitford teaches me everything that i need to survive in the harsh rough world.
it owes me a lot.",Sir Salimullah Medical College,"https://www.google.com/maps/@22.3591136,91.8415966,15z"
639,Md. Sakline Mouzudad,4,Excellent service is provided by this oldest institute.,Sir Salimullah Medical College,"https://www.google.com/maps/@22.3591136,91.8415966,15z"
640,Md. Ahsan Kabir,5,Seems good clean environment. don't have idea about treatment but it should be good with low cost.,Sir Salimullah Medical College,"https://www.google.com/maps/@22.3591136,91.8415966,15z"
641,MR z,5,anytime good treatment for any patient.....,Sir Salimullah Medical College,"https://www.google.com/maps/@22.3591136,91.8415966,15z"
642,Md Tareq,3,"It's a government hospital. Good for instant treatment. 24/7 emergency doctors available. 5
But environment is not so good. Not so clean.
4 on 10",Sir Salimullah Medical College,"https://www.google.com/maps/@22.3591136,91.8415966,15z"
643,prince of Faith,5,Midfort Hoapital,Sir Salimullah Medical College,"https://www.google.com/maps/@22.3591136,91.8415966,15z"
644,Rupangkon Halder Barno,5,Best Hospital in old town.,Sir Salimullah Medical College,"https://www.google.com/maps/@22.3591136,91.8415966,15z"
645,Tusher Ahmmad,5,Country's first general hospital,Sir Salimullah Medical College,"https://www.google.com/maps/@22.3591136,91.8415966,15z"
646,Fardin Khan,5,Make sure that you say rickshaw puller or CNG driver mentioning 'Mitford' as saying Salimullah medical can take you to Salimullah orphanage at Wari,Sir Salimullah Medical College,"https://www.google.com/maps/@22.3591136,91.8415966,15z"
647,Shah Limon Mahmud,5,Very good medical university on old dhaka.....,Sir Salimullah Medical College,"https://www.google.com/maps/@22.3591136,91.8415966,15z"
648,Ahmed Arif,5,Sir Solimullah Medical College is a nice place. I proud of this place.,Sir Salimullah Medical College,"https://www.google.com/maps/@22.3591136,91.8415966,15z"
649,Moazzem Hossain,5,It’s  just an amazing british architectural  medical College building  with country’s second medical institutions......,Sir Salimullah Medical College,"https://www.google.com/maps/@22.3591136,91.8415966,15z"
650,Tona Toni,4,"Sir Salimullah Medical College was established in 1961 as Dhaka Medical School in the old part of the capital city, Dhaka. Mitford Hospital was a part of the school. Donations from sixteen local nawabs and philanthropists financed the erection of a dedicated medical school building in 1889. The school was made a medical college in 1962. To acknowledge the contributions of the nawabs, the college was named after Nawab Sir Salimullah (1871–1915). Until 1957 the License of Medical Faculty (LMF) degree was offered by this college. During 1963–1972 condensed courses for the Bachelor of Medicine, Bachelor of Surgery  (M.B.B.S.) degree were offered. In 1972 the school was upgraded as a full-fledged medical college and the first MBBS students enrolled in 1973.",Sir Salimullah Medical College,"https://www.google.com/maps/@22.3591136,91.8415966,15z"
651,Md Tuhin Bhuiya,2,Environment was pretty bad. But the doctors behaved nicely.,Sir Salimullah Medical College,"https://www.google.com/maps/@22.3591136,91.8415966,15z"
652,Anbir Oyon,3,Government rules & System good but Staff's behave have to be improve & Doctor's should talk with patient more clearly...!!,Sir Salimullah Medical College,"https://www.google.com/maps/@22.3591136,91.8415966,15z"
653,JebuLive,3,Crowded and overruled place but decent doctors,Sir Salimullah Medical College,"https://www.google.com/maps/@22.3591136,91.8415966,15z"
654,Mosleh Uddin swash,5,"High profile management of Mitford Hospital , Dhaka   very fine
Behaviour pattern of doctors and  nurses
very good.
Wash room , bathroom  clean (paying ward area)  but in bathroom no towel rail,  no soap case holder for thar it makes odd situation  for user
Cleaning staff at morning time  sweeping  start just taking break fast time.
This is odd one.
Hope digitised  all system immediately  for betterment  service  towards beneficiary .
But lift condition  of no  1 building mitford hospital, Dhaka, Bangladesh is very  risky even sometime loaded lift  out of order.
Thanks
Alauddin Ahmed",Sir Salimullah Medical College,"https://www.google.com/maps/@22.3591136,91.8415966,15z"
655,Md Farhan,5,Nice service covide 19 vacsin tika,Sir Salimullah Medical College,"https://www.google.com/maps/@22.3591136,91.8415966,15z"
656,Sozolsaif vlogs,5,Famous old Hospital in Bangladesh.,Sir Salimullah Medical College,"https://www.google.com/maps/@22.3591136,91.8415966,15z"
657,chanchal Himu,3,"An old government institution for treatment.  Although there is hope for the poor people in particular, the life of the people here is very bad due to the violence of the brokers.  Still no one to watch.  Not all the necessary government medicines and tests are provided here.  Even though the government spends a lot of money, it is not working even 10 percent for the benefit of the people.",Sir Salimullah Medical College,"https://www.google.com/maps/@22.3591136,91.8415966,15z"
658,Shafqat Hossain Sakib,4,A renound govt. Hospital,Sir Salimullah Medical College,"https://www.google.com/maps/@22.3591136,91.8415966,15z"
659,MD Foysal,4,"Although it’s government hospital but,  Nice environment....",Sir Salimullah Medical College,"https://www.google.com/maps/@22.3591136,91.8415966,15z"
660,Md. Foysal Hossain,4,"Although it’s government hospital but,  Nice environment....",Sir Salimullah Medical College,"https://www.google.com/maps/@22.3591136,91.8415966,15z"
661,Md. Foysal Hossain,5,SUCH A GREAT HOSPITAL,Sir Salimullah Medical College,"https://www.google.com/maps/@22.3591136,91.8415966,15z"
662,chabed alam,5,Today I visit nnuclear department for registered Renogram test it take a long procedure to do this test. I present here before 8 am it open 8:30 am but problem is there stuff who register my test not present.  He is present here after 10 am then I complete my test registration. There stuff behaves not pretty well.Some people who are new here they don't who who to deal with them.,Sir Salimullah Medical College,"https://www.google.com/maps/@22.3591136,91.8415966,15z"
663,mahabub hassan,1,NO ACTIVE EMERGENCY CONTACT NUMBER,Sir Salimullah Medical College,"https://www.google.com/maps/@22.3591136,91.8415966,15z"
664,biswas sabuj,4,"Accessible to all, quality stuffs and doctors are here.",Sir Salimullah Medical College,"https://www.google.com/maps/@22.3591136,91.8415966,15z"
665,SM Ripon,5,Nice,Sir Salimullah Medical College,"https://www.google.com/maps/@22.3591136,91.8415966,15z"
666,Md. Hossen,5,One of Oldest Medical College of Bangladesh,Sir Salimullah Medical College,"https://www.google.com/maps/@22.3591136,91.8415966,15z"
667,DBC Amit,5,Good hospital but it is good enough,Sir Salimullah Medical College,"https://www.google.com/maps/@22.3591136,91.8415966,15z"
668,Buppy Dutta,5,Good medical college hospital with all facility.,Sir Salimullah Medical College,"https://www.google.com/maps/@22.3591136,91.8415966,15z"
669,Manjur Ahmed,5,very very nice hospitality,Sir Salimullah Medical College,"https://www.google.com/maps/@22.3591136,91.8415966,15z"
670,Mahfuj Mredha,4,Nice medical college,Sir Salimullah Medical College,"https://www.google.com/maps/@22.3591136,91.8415966,15z"
671,Doc Fahad,5,One of the Oldest Hospital in Bangladesh. Formerly it was a Medical School which provided DMF degree.From 1971 it was up ranked as a Medical College and MBBS Curriculum were started.,Sir Salimullah Medical College,"https://www.google.com/maps/@22.3591136,91.8415966,15z"
672,Hasan Farhan,3,One of the best hospital in Bangladesh.,Sir Salimullah Medical College,"https://www.google.com/maps/@22.3591136,91.8415966,15z"
673,Saykat Ahmad,4,"The place location is fine..... However if the doctor can become more friendly, it will be great for the patient",Sir Salimullah Medical College,"https://www.google.com/maps/@22.3591136,91.8415966,15z"
674,Mehedi Hasan,5,Very good Hospital,Sir Salimullah Medical College,"https://www.google.com/maps/@22.3591136,91.8415966,15z"
675,kayesh khan,2,They need more improvement.,Sir Salimullah Medical College,"https://www.google.com/maps/@22.3591136,91.8415966,15z"
676,Closed Door,4,Very ola and well. Maintained hospital,Sir Salimullah Medical College,"https://www.google.com/maps/@22.3591136,91.8415966,15z"
677,Ashiqur Rahaman,3,Its a hospital and medical College. In mitford area is a crowd place. Buriganga river beside Mitford.,Sir Salimullah Medical College,"https://www.google.com/maps/@22.3591136,91.8415966,15z"
678,Masudur Rahman,4,They surve very well.,Sir Salimullah Medical College,"https://www.google.com/maps/@22.3591136,91.8415966,15z"
679,Ahmad Zorjis,3,Like any other government hospital.,Sir Salimullah Medical College,"https://www.google.com/maps/@22.3591136,91.8415966,15z"
680,B.M.TAUKIR AHMED,5,It is the  2nd biggest medical College & Hospital in Dhaka city beside Buriganga river.,Sir Salimullah Medical College,"https://www.google.com/maps/@22.3591136,91.8415966,15z"
681,Nayeem Hossain Khan,5,"Sir Salimullah Medical college, situated at Mitford, Dhaka-100, Bangladesh, is a government medical college, which is also affiliated with the University of Dhaka. It started as Dhaka Medical School on 1st July 1875. In 1903. Nawab Sir Salimullah donated money to establish maternity and female eye ward. It was converted to medical college named Mitford Medical College in 1962. In 1963 the college was named after Nawab Sir Salimullah(1871-1915) “Sir Salimullah Medical College” to acknowledge the contributions of the Nawabs.",Sir Salimullah Medical College,"https://www.google.com/maps/@22.3591136,91.8415966,15z"
682,Rahat Aowlad,5,It was a great place to visit for me. Loved it ♥️♥️♥️,Sir Salimullah Medical College,"https://www.google.com/maps/@22.3591136,91.8415966,15z"
683,Samoy sarker,5,Helpful ❤️,Sir Salimullah Medical College,"https://www.google.com/maps/@22.3591136,91.8415966,15z"
684,Armin Anwar,4,Very good govt hospital for poor people,Sir Salimullah Medical College,"https://www.google.com/maps/@22.3591136,91.8415966,15z"
685,Samrat Hossain,5,Oldest Hospital & one of the best Government Hospitals in Bangladesh,Sir Salimullah Medical College,"https://www.google.com/maps/@22.3591136,91.8415966,15z"
686,Richard Malo,5,"One of the oldest and reputed medical college hospital with beautiful view of river Buriganga. The location is super crowded and busiest, business area.",Sir Salimullah Medical College,"https://www.google.com/maps/@22.3591136,91.8415966,15z"
687,Dr. Tareq aziz,4,"Old one, service better but narrow roads",Sir Salimullah Medical College,"https://www.google.com/maps/@22.3591136,91.8415966,15z"
688,RAHMAN MAHBUBUR,4,A public medical college & hospital. Every where you have to wait in que long time for getting service. This is a huge health service provider with every facility. But you can not find the doctor in time. You are to wait long. The connectivity also not good. You are to face serious traffic zam to reach. But the medical college is one of best in public sector.,Sir Salimullah Medical College,"https://www.google.com/maps/@22.3591136,91.8415966,15z"
689,Asrin 135,5,"It is one of the renowned medical college in Bangladesh,,it is situated in old dhaka,",Sir Salimullah Medical College,"https://www.google.com/maps/@22.3591136,91.8415966,15z"
690,Krishna Mondal,5,"In 1962, it was transformed into a medical college.  Considering the contribution of the Nawab family, the medical college was named after Nawab Sir Salimullah .  In the early days, Licentiate of the Medical Faculty (LMF) degree in medicine was given from here.  In 1958, the LMF course was discontinued.  Later, short MBBS courses were introduced from 1983-1982. In 1982, the government declared it a full-fledged medical college.  MBBS 1st batch class started in 1983.",Sir Salimullah Medical College,"https://www.google.com/maps/@22.3591136,91.8415966,15z"
691,Emon Prodhan,,Very good,Sir Salimullah Medical College,"https://www.google.com/maps/@22.3591136,91.8415966,15z"
692,Mehade Hasan,5,"Sir Salimullah Medical College Metford Hospital has great past. Old hospital in Puran Dhaka. 100 years old government hospital. Mainly medical college campus & others patients treatment building available here. Building -1, Building -2 & Building -3 are main treatment department.

Emergency center & out door center are always busy. Emergency center are providing service 24 hours. Emergency center quick response for emergency treatment for any accident. Any kind of medical problem, people are come here for better treatment. Free treatment for people provide by government. Administration of this hospital are trying their best. Doctors & Nurses are  served best service. Some findings are there:
📍Car parking area are not enough.
📍Wheelchair entrance & parking facilities are available.
📍Lift service are available.
📍Restroom are not so clean.
📍Most of the area or buildings are not under CC Camera.
📍Security level are good position.",Sir Salimullah Medical College,"https://www.google.com/maps/@22.3591136,91.8415966,15z"
693,Ramzan Ali,5,It was great experience to me.,Sir Salimullah Medical College,"https://www.google.com/maps/@22.3591136,91.8415966,15z"
694,Jahid Hasan,5,good service  place is very good,Sir Salimullah Medical College,"https://www.google.com/maps/@22.3591136,91.8415966,15z"
695,Mainul Islam Shahin,5,It's awesome hospital.,Sir Salimullah Medical College,"https://www.google.com/maps/@22.3591136,91.8415966,15z"
696,Md.Zynal Abden Jewel,5,It's a government medical college hospital. It's a very important and helpful place for all kinds of patient.,Sir Salimullah Medical College,"https://www.google.com/maps/@22.3591136,91.8415966,15z"
697,Anup Sen,5,"sir Salimullah Medical College is so good.
If a patient wants to see a doctor for any of his problems, regardless of the disease, he can get proper treatment.",Sir Salimullah Medical College,"https://www.google.com/maps/@22.3591136,91.8415966,15z"
698,Mominur Rashid,5,famous and oldest medical college.,Sir Salimullah Medical College,"https://www.google.com/maps/@22.3591136,91.8415966,15z"
699,Rαsed S' Råhi,5,Oldest medical institute in Dhaka,Sir Salimullah Medical College,"https://www.google.com/maps/@22.3591136,91.8415966,15z"
700,Saikat Mandal Tanu,5,"Though it's a government hospital, but they have maintain their quality and environment.",Sir Salimullah Medical College,"https://www.google.com/maps/@22.3591136,91.8415966,15z"
701,Papel Mahammud Pappu,,"Its a Government hospital
But service & treatment Very good
Environment also good
Doctors always available here
Wheelchair entrance and parking available
Car parking available
Largest Government hospital in dhaka",Shaheed Suhrawardy Medical College and Hospital,"https://www.google.com/maps/@22.3591136,91.8415966,15z"
702,CRS ENGINEERING,5,Shaheed Suhrawardy Medical College and Hospital,Shaheed Suhrawardy Medical College and Hospital,"https://www.google.com/maps/@22.3591136,91.8415966,15z"
703,Md Kamal Hossain,5,"Shaheed Suhrawardy Medical College (ShSMC) is the 14th government medical college of Bangladesh which is established in 2006. It is situated in the north-western part of Dhaka beside the National Parliament House, having a unique architectural campus and excellent academic atmosphere. The area is commonly known as medical zone and this medical college is surrounded by a number of medical institutes; National Institute of Cardiovascular Diseases, National Institute of Kidney Diseases and Urology, National Institute of Mental Health, Bangladesh Institute of Child Health, National Institute of Traumatology, National Institute of Ophthalmology and National Institute of Neuro Science. Shaheed Suhrawardy Medical College Hospital has a long heritage of discharging health care services and also has a proud history of patronizing many of the above medical institutes to establish and flourish. We have a great commitment to provide top class medical education, excellent training and quality research through eminent and experienced teachers.",Shaheed Suhrawardy Medical College and Hospital,"https://www.google.com/maps/@22.3591136,91.8415966,15z"
704,Asif Mahmood,4,"After being established as a newest member in medical colleges of Bangladesh Shaheed Suhrawardy Medical College has achieved internal glory in the arena of research both in postgraduate and undergraduate research and conferences. Students have attended European Students conference in 2011, 2012, 2013 as research presenters, workshop participants and ambassador, the AIMS, Lisbon, Portugal in 2012, 2013 as research presenters and ambassador, LIMSC, Netherlands, 2011, 2012 as research presenters, workshop participants and ambassador, KARMIC, India 2012, 2013, research presenter, workshop participant and ambassador. Konference, Kolkata-2012 as workshop participant, research presenter and ambassador and achieved awards and kept the pride and honor of the medical college.",Shaheed Suhrawardy Medical College and Hospital,"https://www.google.com/maps/@22.3591136,91.8415966,15z"
705,Fardaus Hossain,4,Big medical college and hospital,Shaheed Suhrawardy Medical College and Hospital,"https://www.google.com/maps/@22.3591136,91.8415966,15z"
706,Mohammad Mehrab Hossain,5,It's a Government Hospital. Previously it was Dirty environment everywhere but right now it tottaly clean and sound.Best of Luck.,Shaheed Suhrawardy Medical College and Hospital,"https://www.google.com/maps/@22.3591136,91.8415966,15z"
707,Farabi Rizvi,5,"Quite big in nature, has a medical college.. The buildings are designed really well.. The medical facilities are also quite standard..",Shaheed Suhrawardy Medical College and Hospital,"https://www.google.com/maps/@22.3591136,91.8415966,15z"
708,Muqit (Shourav),5,"Shaheed Suhrawardy Medical College and Hospital was founded in 1963 at Sher-e-Bangla nagar, dhaka.
The design & master plans was done by American architect Loise Khan. Exposed ceramic brick work with thick at that time crest a new era of architecture in Bangladesh.
It was only a medical hospital, then in 2006 it extended with Medical College.",Shaheed Suhrawardy Medical College and Hospital,"https://www.google.com/maps/@22.3591136,91.8415966,15z"
709,Hafiz Shuputra,5,Long que to pass,Shaheed Suhrawardy Medical College and Hospital,"https://www.google.com/maps/@22.3591136,91.8415966,15z"
710,Aayaz Ahmed,2,"Shaheed Suhrawardy Medical College (ShSMC) is the 14th government medical college of Bangladesh which is established in 2006. It is situated in the north-western part of Dhaka beside the National Parliament House, having a unique architectural campus and excellent academic atmosphere and
One of the corruption and too much patients . Totally bad administration also huge corrupted area with many kinds of broker.
Not safe and trustable area for every one.
Beware of many kinds of broker.
Doctor's behaviour and service is good also nurse is behaviour superb.",Shaheed Suhrawardy Medical College and Hospital,"https://www.google.com/maps/@22.3591136,91.8415966,15z"
711,TheDevil Queen,5,"Suhrawardy Hospital is a government hospital where rich and poor get treatment in the morning.  All the medicines and other expenses of the hospital are paid by the government. If there is no problem, one can buy a ticket in his own name with only 10 rupees and go to the room of a certain doctor and get the service.  Is free.  The hospital has many skilled doctors and nurses who work in this hospital by the government in many trials.  If necessary, doctors from abroad come and provide servicesShaheed Suhrawardy Medical College Hospital is a third tier government-owned hospital located in Sher-e-Bangla Nagar, Dhaka, the capital of Bangladesh.  It was established in 1983 to spread medical knowledge across the country and to develop skilled doctors.  At present it has 65 beds and has 500 students and 2010 staff.",Shaheed Suhrawardy Medical College and Hospital,"https://www.google.com/maps/@22.3591136,91.8415966,15z"
712,Julfikar Rahaman,4,"Shaheed Suhrawardy Medical College (ShSMC) is a public medical college and hospital located in Dhaka, the capital city of Bangladesh. This medical college is the third public medical college in the government medical college rank after DMC & SSMC. It has been included in the Avicenna Directory of Medical Schools and International Medical Education Directory (IMED).
Shaheed Suhrawardy Hospital was established in 1963 as Ayub Central Hospital in Sher-e-Bangla Nagor, Dhaka, Bangladesh. The hospital building was designed by architect Louis I Kahn. After a long period of consideration, the Bangladeshi government decided on 5 September 2005 to turn Shaheed Suhrawardy Hospital into a medical college.[1] Educational activities in the college began on 6 May 2006.[2] In the inauguration ceremony the then health minister, Khandakar Mosharof Hossain started the educational activities officially. Originally, the medical college was known as Begum Khaleda Zia Medical College[3] and had 100 students.[4] and begun its journey with 100 students.[5]",Shaheed Suhrawardy Medical College and Hospital,"https://www.google.com/maps/@22.3591136,91.8415966,15z"
713,Nibadita Roy,1,i dont know about their health service but their other services arent good.,Shaheed Suhrawardy Medical College and Hospital,"https://www.google.com/maps/@22.3591136,91.8415966,15z"
714,Tanvir Nayeem,5,Front of shaheed suhrawardi hospital is best place for natural environment.,Shaheed Suhrawardy Medical College and Hospital,"https://www.google.com/maps/@22.3591136,91.8415966,15z"
715,BD Education help,5,It is govt. Hospital. It is a big hospital. You can get medical treatment from here in a cheep rate,Shaheed Suhrawardy Medical College and Hospital,"https://www.google.com/maps/@22.3591136,91.8415966,15z"
716,Hwang yeung,4,"this hospital is the work of louis kahn, great american architect. Yet because of that its located in bangladesh. Few has visited this true piece of masterwork. The brick vaults and concrete structure still remain almost the same as its first completion. I would recommend this project to people who come all the way to dhaka to see the parliament.",Shaheed Suhrawardy Medical College and Hospital,"https://www.google.com/maps/@22.3591136,91.8415966,15z"
717,Sheik Shahed Jamil,2,"The bad side is that the government low class employees of this hospital have the worst job ethics. Nobody is here to control them. They don't maintain work time. They are never present when needed. Bad food quality, they don't maintain standard. And, what is worse, they don't treat the help seekers right. These third and fourth class employees need to be brought to the book. The good side: The doctores in the emergency try their best to help. When the load is high, you might not expect good service, but in most cases, doctors are professionals.
Worst side: One of the medicine specialists of who see patients here once prescribed an unnecessary and expensive  vitamin capsule for my brother with fever. The manufacturer of the capsule is an Islamic company. I'm trying to understand the network here... how deep the root has gone",Shaheed Suhrawardy Medical College and Hospital,"https://www.google.com/maps/@22.3591136,91.8415966,15z"
718,Tanjil Alom Jahid,5,This is one of the best government medical college and hospital in Bangladesh. In here many student complete their doctored degree and give our country's people a great treatment.,Shaheed Suhrawardy Medical College and Hospital,"https://www.google.com/maps/@22.3591136,91.8415966,15z"
719,The Spirit of Spirituality,5,Very very important and useful for patient…,Shaheed Suhrawardy Medical College and Hospital,"https://www.google.com/maps/@22.3591136,91.8415966,15z"
720,MAHABUB ALOM Babu,4,"Hospital quality is good. Doctor's use is good. If anyone can patiently get medical treatment, he will get good treatment because there are so many patients.",Shaheed Suhrawardy Medical College and Hospital,"https://www.google.com/maps/@22.3591136,91.8415966,15z"
721,Mithun Ghosh,5,One of the best govt hospital in Bangladesh,Shaheed Suhrawardy Medical College and Hospital,"https://www.google.com/maps/@22.3591136,91.8415966,15z"
722,Margub Rahbar,4,"one of the best medical College and hospital in Bangladesh.  It's situated im sher e bangla nogor agargao,infromt of College gate. THIS is the 4th largest hospital of Bangladesh.  As if a government medical hospital,  their staffs are not good as expected.  But the doctor's are so much professional. I hope their service will be fine soon.",Shaheed Suhrawardy Medical College and Hospital,"https://www.google.com/maps/@22.3591136,91.8415966,15z"
723,kamrul Hoque Kalpan,5,A govt. medicsl college hospital and the best medical center for the medical treatment of any diseases for the mads general people of whole Bangladesh,Shaheed Suhrawardy Medical College and Hospital,"https://www.google.com/maps/@22.3591136,91.8415966,15z"
724,Md Shakil,5,Here most of the doctors are very helpfull.,Shaheed Suhrawardy Medical College and Hospital,"https://www.google.com/maps/@22.3591136,91.8415966,15z"
